Product,Source,Price,Qty,Unit,Low,High,Avg Price USD,MOQ,MOQ,Supply capacity,Ability,Seller,Seller Profile Url, Seller company contact url, Phone No,Mobile,Address,Zip,Country,State,City,Website,Raw Address
arabica coffee bean price,http://www.alibaba.com/product-gs/672574201/arabica_strong_coffee_strong_strong_bean.html?s=p,US $2700 / Ton ( FOB Price),,,,,,,19.8 Tons (Min. Order),,Not available,Baoshan Yatong Coffee Commercial Co.  Ltd.,http://yatongcoffee.en.alibaba.com/company_profile.html#top-nav-bar,http://yatongcoffee.en.alibaba.com/contactinfo.html, 86-0875-2129661,N/A, No. 45 Xiaxiang Street Longyang District Baoshan Yunnan China (Mainland), 678000, China (Mainland), Yunnan, Baoshan,
unroasted arabica coffee beans,http://www.alibaba.com/product-gs/1611606618/unroasted_arabica_strong_coffee_strong_strong.html?s=p,US $2.8-3.3 / Kilogram ( FOB Price),,,,,,,10000 Kilograms (Min. Order),,Not available,Zhaotong Sino-Agro Import & Export Co.  Ltd.,http://ynztzn.en.alibaba.com/company_profile.html#top-nav-bar,http://ynztzn.en.alibaba.com/contactinfo.html, 0086-871-63338560, 8613908700957, Room 404Buld CDongsirenjiaNo.338 Dongsi StreetXishan District, 650000, China (Mainland), Yunnan, Kunming,
New Crop China Arabica Coffee Beans,http://www.alibaba.com/product-gs/1350899524/New_Crop_China_Arabica_strong_Coffee.html?s=p,Not available,,,,,,,18 Metric Tons (Min. Order),,Not available,Dehong Hogood Coffee Co.  Ltd.,http://hougucoffee.en.alibaba.com/company_profile.html#top-nav-bar,http://hougucoffee.en.alibaba.com/contactinfo.html, 86-871-5392451, 8613888403275, Beside Mangshi Airport  Luxi Dehong Dai & Jingpo Autonomous Prefecture Yunnan China (Mainland), 650031, China (Mainland), Yunnan, Dehong,
China Arabica Green Coffee Bean Grade AA,http://www.alibaba.com/product-gs/890285656/China_Arabica_Green_strong_Coffee_strong.html?s=p,Not available,,,,,,,21 Metric Tons (Min. Order),,Not available,Yunnan Coffee Processing Plant,http://chinacoffee.en.alibaba.com/company_profile.html#top-nav-bar,http://chinacoffee.en.alibaba.com/contactinfo.html,N/A,N/A,N/A,N/A, China (Mainland),N/A,N/A,
2012CROP CHINA GREEN BEANS/CHINA GREEN COFFEE BEANS/GREEN MUNG BEANS/GREEN BEANS EXTRACT,http://www.alibaba.com/product-gs/1052189609/2012CROP_CHINA_GREEN_strong_BEANS_strong.html?s=p,US $1200-1500 / Ton ( FOB Price),,,,,,,23 Tons (Min. Order),,Not available,Dalian Masoo International Trading Co.  Ltd.,http://masoo.en.alibaba.com/company_profile.html#top-nav-bar,http://masoo.en.alibaba.com/contactinfo.html, 86-411-82768618, 86-13840815182, Room 2210 No.20B Gangwan Street Zhongshan District Dalian China., 116001, China (Mainland), Liaoning, Dalian,
Premium Gourmet Hand Selected Sumatra Coffee Beans,http://www.alibaba.com/product-detail/Premium-Gourmet-Hand-Selected-Sumatra-strong_108490964.html,Not available,,,,,,,20 Feet (Min. Order),,Not available,G-TRADE NEW ZEALAND LIMITED,http://laproprietdegregoria.trustpass.alibaba.com/company_profile.html#top-nav-bar,http://laproprietdegregoria.trustpass.alibaba.com/contactinfo.html, 64-21-775287, 021 775287, 9 Rockfield Road, 1061, New Zealand,N/A, Ellerlie,
Full washed arabica coffee bean,http://www.alibaba.com/product-gs/1082946744/Full_washed_arabica_strong_coffee_strong.html,US $2300-3000 / Ton ( FOB Price),,,,,,,10 Tons (Min. Order),,Not available,Yunnan Zheng Ding Coffee Co.  Ltd.,http://ynzdkf.en.alibaba.com/company_profile.html#top-nav-bar,http://ynzdkf.en.alibaba.com/contactinfo.html, 0086-871-66099196,N/A, No-16 shutong road,N/A, China (Mainland), Yunnan, kunming,
Vietnam Robusta Coffee Bean,http://www.alibaba.com/product-detail/Vietnam-Robusta-strong-Coffee-strong-strong_124590467.html,Not available,,,,,,,1 Twenty-Foot Container (Min. Order),,Not available,NOVA CO.  LTD,http://nova.trustpass.alibaba.com/company_profile.html#top-nav-bar,http://nova.trustpass.alibaba.com/contactinfo.html, 84-4-35576135 - 35576133,N/A, Thanh Xuan, 00000, Vietnam, Hanoi, Hanoi,
organic Arabica coffee beans from Laos very high quality,http://www.alibaba.com/product-gs/623178667/organic_Arabica_strong_coffee_strong_strong.html,US $5.8-6.5 / Kilogram ( FOB Price),,,,,,,1000 Metric Tons (Min. Order),,Not available,Yunnan Changshengda Investment Co.  Ltd.,http://yncsd.en.alibaba.com/company_profile.html#top-nav-bar,http://yncsd.en.alibaba.com/contactinfo.html, 86-0871-833195918213455230, 13518787690, Kunming High-tech ZoneNo.998 Hoi Yuen Road, 650000, China (Mainland), Yunnan, kunming,
Export washed arabica green coffee beans,http://www.alibaba.com/product-gs/942065494/Export_washed_arabica_green_strong_coffee.html,US $3-6 / Pound ( FOB Price),,,,,,,1 Metric Ton (Min. Order),,Not available,Shijiazhuang Zhong Ao Industrial Pumps Co.  Ltd.,http://sjzgyb.en.alibaba.com/company_profile.html#top-nav-bar,http://sjzgyb.en.alibaba.com/contactinfo.html, 86-157-52029284,N/A, changhong Rd, 655001, China (Mainland), Yunnan, Kunmin,
raw coffee bean,http://www.alibaba.com/product-gs/1611492438/raw_strong_coffee_strong_strong_bean.html,US $2000-2500 / Metric Ton ( FOB Price),,,,,,,1 Metric Ton (Min. Order),,Not available,Wuhan Dongtianheng Trade Co.  Ltd.,http://dongtianheng.en.alibaba.com/company_profile.html#top-nav-bar,http://dongtianheng.en.alibaba.com/contactinfo.html, 0086-27-82641887, 13871061797, Rm. 2 26-27/F Unit 2 Bldg. 1 No. 2 Taibei 1st Road(Tianxia Int'l Building) Taibei St. Jiang'an District, 430015, China (Mainland), Hubei, WUHAN,
Yunnan Green coffee beans,http://www.alibaba.com/product-gs/521465316/Yunnan_Green_strong_coffee_strong_strong.html,US $1800-2500 / Ton ( FOB Price),,,,,,,20 Tons (Min. Order),,Not available,Kunming Qianxi Industry & Trade Co.  Ltd.,http://qxkm.en.alibaba.com/company_profile.html#top-nav-bar,http://qxkm.en.alibaba.com/contactinfo.html, 0086-0871-8053368, 13116950460, Dongjiawan Road Kunming Yunnan China, 650041, China (Mainland), Yunnan, kunming,
roasted coffee beans Pregiata,http://www.alibaba.com/product-detail/roasted-strong-coffee-strong-strong-beans_149374178.html,Not available,,,,,,,1 Pallet (Min. Order),,Not available,ESPRESSO SICILIANO SRL,http://it1019060487.trustpass.alibaba.com/company_profile.html#top-nav-bar,http://it1019060487.trustpass.alibaba.com/contactinfo.html, 0039-347-8213173,N/A, via pietra roma, 98070, Italy, italy, torrenova,
Robusta coffee bean,http://www.alibaba.com/product-detail/Robusta-strong-coffee-strong-strong-bean_139784200.html,Not available,,,,,,,1 Twenty-Foot Container (Min. Order),,Not available,LAKKI CORPORATION,http://lakki.trustpass.alibaba.com/company_profile.html#top-nav-bar,http://lakki.trustpass.alibaba.com/contactinfo.html, 84-909-497286,N/A, 1/47 Nguyen The Truyen, 84, Vietnam, Ho Chi Minh City, Tan Phu,
robusta roasted coffee bean,http://www.alibaba.com/product-detail/robusta-roasted-strong-coffee-strong-strong_122669821.html,Not available,,,,,,,Not available,,Not available,THOMAS INTERNATIONAL,http://arthomas.trustpass.alibaba.com/company_profile.html#top-nav-bar,http://arthomas.trustpass.alibaba.com/contactinfo.html, 91-44-25352812, 9840104708, New No. 306 Linghi Chetty Street, 600 001, India, Tamil Nadu, Chennai,
Robusta Coffee Bean,http://www.alibaba.com/product-detail/Robusta-strong-Coffee-strong-strong-Bean_137136848.html,US $1900-2000 / Ton ( FOB Price),,,,,,,19 Tons (Min. Order),,Not available,VIETWOODEE JOINT STOCK COMPANY,http://vietwoodee.trustpass.alibaba.com/company_profile.html#top-nav-bar,http://vietwoodee.trustpass.alibaba.com/contactinfo.html, 84-4-85898541, 84973227101, Nguyen Ngoc Vu, 10000, Vietnam, Hanoi, Hanoi,
Original Arabica Green Coffee Bean from Chinese capital of tea,http://www.alibaba.com/product-gs/467602266/Original_Arabica_Green_strong_Coffee_strong.html,Not available,,,,,,,5 Tons (Min. Order),,Not available,Hainan Fuwang Industrial Co.  Ltd.,http://sinofuwang.en.alibaba.com/company_profile.html#top-nav-bar,http://sinofuwang.en.alibaba.com/contactinfo.html, 86-898-66729565, 13518811898, Room9B Beijing Building No 56 Guomao streetHaikou city Hainan provincePR China, 570125, China (Mainland), Hainan, Haikou,
ROASTED ROBUSTA COFFEE BEANS,http://www.alibaba.com/product-detail/ROASTED-ROBUSTA-strong-COFFEE-strong-strong_137111589.html,Not available,,,,,,,1000 Kilograms (Min. Order),,Not available,AN THAI DEVELOPMENT AND INVESTMENT JOINT STOCK COMPANY,http://anthaicafe.trustpass.alibaba.com/company_profile.html#top-nav-bar,http://anthaicafe.trustpass.alibaba.com/contactinfo.html, 84-8-66561122, 84894 215 1117, 263 Vuon Lai Str Phu Tho Hoa Ward Tan Phu Dist, 848, Vietnam, Ho Chi Minh City, Ho Chi Minh,
Vietnam Robusta Coffee beans,http://www.alibaba.com/product-detail/Vietnam-Robusta-strong-Coffee-strong-strong_125297372.html,Not available,,,,,,,Not available,,Not available,VINACAM JOINT STOCK COMPANY,http://vn1007781435.trustpass.alibaba.com/company_profile.html#top-nav-bar,http://vn1007781435.trustpass.alibaba.com/contactinfo.html, 84-8-38246526, 0084983807746, 28 MAC Dinh Chi District 1, 84, Vietnam,N/A, Ho Chi Minh City,
100% INDONESIA KOPI LUWAK GREEN COFFEE BEANS,http://www.alibaba.com/product-gs/835034539/100_INDONESIA_KOPI_LUWAK_GREEN_strong.html,Not available,,,,,,,1 Kiloampere (Min. Order),,Not available,CHONG SEN TRADING CO,http://chongsen.en.alibaba.com/company_profile.html#top-nav-bar,http://chongsen.en.alibaba.com/contactinfo.html, 00-852-25433397, 91895198, 9/F 158 Connaught Road Central, 00000, Hong Kong,N/A, Hong Kong,
2012 crop raw Coffee beans,http://www.alibaba.com/product-gs/565676009/2012_crop_raw_strong_Coffee_strong.html,Not available,,,,,,,20 Metric Tons (Min. Order),,Not available,Gansu Yusheng Agricultural Products Co.  Ltd.,http://gsys.en.alibaba.com/company_profile.html#top-nav-bar,http://gsys.en.alibaba.com/contactinfo.html, 86-931-8457921,N/A, Flat B15th FloorPeifeng Mansion West BlockNo.35 Linxia RoadLanzhouChina, 730000, China (Mainland), Gansu, LanzhouChina,
WASHED ROBUSTA COFFEE BEANS,http://www.alibaba.com/product-detail/WASHED-ROBUSTA-strong-COFFEE-strong-strong_134854541.html,US $1900-2300 / Ton ( FOB Price),,,,,,,19.20 Tons (Min. Order),,Not available,MINH PHUONG GENERAL TRADING COMPANY LIMITED,http://vn1007092654.trustpass.alibaba.com/company_profile.html#top-nav-bar,http://vn1007092654.trustpass.alibaba.com/contactinfo.html, 84-38-3515888, 84-917752210, 15 Ho Tong Thoc Str.  Nghi Phu, 420000, Vietnam, Nghe An, Vinh,
Arabica Coffee Bean Excellent Quality From Thailand,http://www.alibaba.com/product-detail/Arabica-strong-Coffee-strong-strong-Bean_140722550.html,US $3-6 / Kilogram ( FOB Price),,,,,,,20 Tons (Min. Order),,Not available,WANGTHONGFACTORY LIMITED PARTNERSHIP,http://wangthongfactory.trustpass.alibaba.com/company_profile.html#top-nav-bar,http://wangthongfactory.trustpass.alibaba.com/contactinfo.html, 66-84-6883700, 0066846883700, Mittrapab, 65130, Thailand, Phitsanulok, Wangthong,
green coffee bean,http://www.alibaba.com/product-detail/green-strong-coffee-strong-strong-bean_154032343.html,Not available,,,,,,,20 Tons (Min. Order),,Not available,OLD LAND TRADE CO,http://au106358433.trustpass.alibaba.com/company_profile.html#top-nav-bar,http://au106358433.trustpass.alibaba.com/contactinfo.html, 61-404-874988,N/A, 30a leamington rd, 2117, Australia, New South Wales, dundas,
Coffee Beans,http://www.alibaba.com/product-detail/-strong-Coffee-strong-strong-Beans_217161761.html,Not available,,,,,,,1 Twenty-Foot Container (Min. Order),,Not available,ZAFCOMM LLC,http://zafcomm.trustpass.alibaba.com/company_profile.html#top-nav-bar,http://zafcomm.trustpass.alibaba.com/contactinfo.html, 971-4-2257441, 0097155 9769726, 33 Al Ahmadya Bldg / Po Box 64516, 64516, United Arab Emirates, Dubai, Dubai,
Roasted Coffee Beans,http://www.alibaba.com/product-detail/Roasted-strong-Coffee-strong-strong-Beans_123495858.html,US $6.5 / Kilogram ( FOB Price),,,,,,,2000 Kilograms (Min. Order),,Not available,NHAN MINH INTERNATIONAL TRADING CO.  LTD,http://qcoffee.trustpass.alibaba.com/company_profile.html#top-nav-bar,http://qcoffee.trustpass.alibaba.com/contactinfo.html, 84-8-22202034, 84989774462, Level 6 Indo China Park Tower No 4 Nguyen Dinh Chieu St, 17200, Vietnam,N/A, Ho Chi Minh,
coffee beans importers,http://www.alibaba.com/product-gs/1081264248/_strong_coffee_strong_strong_beans.html,US $3400 / Ton ( FOB Price),,,,,,,19.8 Tons (Min. Order),,Not available,Baoshan Yatong Coffee Commercial Co.  Ltd.,http://yatongcoffee.en.alibaba.com/company_profile.html#top-nav-bar,http://yatongcoffee.en.alibaba.com/contactinfo.html, 86-0875-2129661,N/A, No. 45 Xiaxiang Street Longyang District Baoshan Yunnan China (Mainland), 678000, China (Mainland), Yunnan, Baoshan,
Sweet Blended Italian Roasted Espresso Coffee Beans,http://www.alibaba.com/product-detail/Sweet-Blended-Italian-Roasted-Espresso-strong_134572340.html,Not available,,,,,,,Not available,,Not available,REDSPIN S.R.L.,http://it100613774.trustpass.alibaba.com/company_profile.html#top-nav-bar,http://it100613774.trustpass.alibaba.com/contactinfo.html, 39-011-09 68 819,N/A, Corse Re Umberto I 61, 10128, Italy, Torino (TO), Torino,
Colombian Coffee Beans In Bulk Packages,http://www.alibaba.com/product-detail/Colombian-strong-Coffee-strong-strong-Beans_11421816.html,Not available,,,,,,,Not available,,Not available,ANDES TRADING COMPANY,http://pelusomejia.trustpass.alibaba.com/company_profile.html#top-nav-bar,http://pelusomejia.trustpass.alibaba.com/contactinfo.html, 57-311-3001549, 57 311 300 1549, Cl. 3 No. 25-299, 0000, Colombia, Antioquia, Medellin,
ROBUSTA COFFEE BEANS,http://www.alibaba.com/product-detail/ROBUSTA-strong-COFFEE-strong-strong-BEANS_150543827.html,Not available,,,,,,,1 Metric Ton (Min. Order),,Not available,ANANDAA ENTERPRISES,http://in1019629397.trustpass.alibaba.com/company_profile.html#top-nav-bar,http://in1019629397.trustpass.alibaba.com/contactinfo.html, 91-80-25660151, 8892055387, No , 560016, India, Karnataka, BANGALORE,
Costa Rica green coffee beans SHB from tarrazu,http://www.alibaba.com/product-detail/Costa-Rica-green-strong-coffee-strong_158011096.html,Not available,,,,,,,250 Bags (Min. Order),,Not available,SATURNO GLOBAL,http://cr1044597175.trustpass.alibaba.com/company_profile.html#top-nav-bar,http://cr1044597175.trustpass.alibaba.com/contactinfo.html, 506-24790101,N/A, 100 m sur 25 este de la gasolinera La Fortuna,N/A, Costa Rica, Alajuela, La Fortuna,
coffee bean in Arabica coffee beans,http://www.alibaba.com/product-gs/1441506193/_strong_coffee_strong_strong_bean.html,US $2.0-3.3 / Kilogram ( FOB Price),,,,,,,500 Kilograms (Min. Order),,Not available,Zhaotong Sino-Agro Import & Export Co.  Ltd.,http://ynztzn.en.alibaba.com/company_profile.html#top-nav-bar,http://ynztzn.en.alibaba.com/contactinfo.html, 0086-871-63338560, 8613908700957, Room 404Buld CDongsirenjiaNo.338 Dongsi StreetXishan District, 650000, China (Mainland), Yunnan, Kunming,
Arabica green coffee bean,http://www.alibaba.com/product-gs/335653600/Arabica_green_strong_coffee_strong_strong.html,Not available,,,,,,,19.2 Metric Tons (Min. Order),,Not available,Dehong Hogood Coffee Co.  Ltd.,http://hougucoffee.en.alibaba.com/company_profile.html#top-nav-bar,http://hougucoffee.en.alibaba.com/contactinfo.html, 86-871-5392451, 8613888403275, Beside Mangshi Airport  Luxi Dehong Dai & Jingpo Autonomous Prefecture Yunnan China (Mainland), 650031, China (Mainland), Yunnan, Dehong,
Sumatra Arabica Coffee Bean,http://www.alibaba.com/product-detail/Sumatra-Arabica-strong-Coffee-strong-strong_143976106.html,US $3-6 / Kilogram ( FOB Price),,,,,,,20 Tons (Min. Order),,Not available,NAGAMAS JAYA (M) SDN. BHD.,http://my1022076991.trustpass.alibaba.com/company_profile.html#top-nav-bar,http://my1022076991.trustpass.alibaba.com/contactinfo.html, 60-6-283 8164, 0102310953, 65jalan tkl 1 taman kota laksamana, 75200, Malaysia, Melaka, melaka,
Washed/Unwashed Arabica Green Coffee Beans,http://www.alibaba.com/product-detail/Washed-Unwashed-Arabica-Green-strong-Coffee_144015298.html,US $3000-4000 / Metric Ton ( FOB Price),,,,,,,19.2 Metric Tons (Min. Order),,Not available,KHOI NGUYEN TRADING AND TECHNOLOGY CO.  LTD,http://khoinguyen.trustpass.alibaba.com/company_profile.html#top-nav-bar,http://khoinguyen.trustpass.alibaba.com/contactinfo.html, 84-8-38445785,N/A, 307 / 5 3rd floor Doxaco Building Nguyen Van Troi Str., 848, Vietnam, HCMC, Ho Chi Minh,
Coffee Beans from Vietnam,http://www.alibaba.com/product-detail/-strong-Coffee-strong-strong-Beans_135817456.html,US $1.600-1800 / Metric Ton ( FOB Price),,,,,,,19 Metric Tons (Min. Order),,Not available,SONG HAU FOOD PROCESSING JOINT STOCK CORPORATION,http://sohafood.trustpass.alibaba.com/company_profile.html#top-nav-bar,http://sohafood.trustpass.alibaba.com/contactinfo.html, 84-7103-605783,N/A, Co Do,N/A, Vietnam, Can Tho, Can Tho,
Green Coffee Beans,http://www.alibaba.com/product-detail/Green-strong-Coffee-strong-strong-Beans_100613547.html,Not available,,,,,,,50 Metric Tons (Min. Order),,Not available,Boom Buying Private Limited,http://boombuying.trustpass.alibaba.com/company_profile.html#top-nav-bar,http://boombuying.trustpass.alibaba.com/contactinfo.html, 91-11-30202172, 919350529894, E-986 C. R. Park, 110019, India, Delhi, New Delhi,
Robusta Coffee Bean (R1 Screen 18),http://www.alibaba.com/product-detail/Robusta-strong-Coffee-strong-strong-Bean_136714683.html,Not available,,,,,,,18 Tons (Min. Order),,Not available,TUAN MINH INVESTMENT COMPANY LIMITED,http://tuanminh.trustpass.alibaba.com/company_profile.html#top-nav-bar,http://tuanminh.trustpass.alibaba.com/contactinfo.html, 84-4-37713825, 84984663966, Hang Voi Street Hoan Kiem, 10000, Vietnam, Hanoi, Hanoi,
VIETNAM ROBUSTA COFFEE BEAN,http://www.alibaba.com/product-detail/VIETNAM-ROBUSTA-strong-COFFEE-strong-strong_135755584.html,US $1800-2000 / Ton ( FOB Price),,,,,,,19.2 Metric Tons (Min. Order),,Not available,VISIMEX JOINT STOCK COMPANY,http://hungnic.trustpass.alibaba.com/company_profile.html#top-nav-bar,http://hungnic.trustpass.alibaba.com/contactinfo.html, 84-4-39765905, 0084 913 526 426, 108 Lo Duc Street Hanoi Vietnam, 10000, Vietnam, Ha Noi, Ha Noi,
Vietnam Coffee Bean,http://www.alibaba.com/product-detail/Vietnam-strong-Coffee-strong-strong-Bean_126045213.html,Not available,,,,,,,05 Metric Tons (Min. Order),,Not available,RITA FOOD & DRINK COMPANY LIMITED,http://vn105660124.trustpass.alibaba.com/company_profile.html#top-nav-bar,http://vn105660124.trustpass.alibaba.com/contactinfo.html, 0084-650-3784688, 0084-1684548121, Unit# 30 VSIP Street 4 Vietnam-Singapore Industrial Park, 000000, Vietnam, Binh Duong, Thuan An District,
GREEN COFFEE BEAN,http://www.alibaba.com/product-detail/GREEN-strong-COFFEE-strong-strong-BEAN_148213751.html,Not available,,,,,,,Not available,,Not available,PHYTO PLANET COMERCIAL EXPORTADORA E IMPORTADORA LTDA ME,http://phytoplanet.trustpass.alibaba.com/company_profile.html#top-nav-bar,http://phytoplanet.trustpass.alibaba.com/contactinfo.html, 55-31-36542242, 55 31 8826 9941, Av. Raja Gabaglia 4859/214, 30360663, Brazil, Minas Gerais, Belo Horizonte,
COFFEE BEANS FROM VIETNAM,http://www.alibaba.com/product-detail/-strong-COFFEE-strong-strong-BEANS_135220262.html,US $5-6 / Kilogram ( FOB Price),,,,,,,3 Tons (Min. Order),,Not available,SOUTHERN TOP CO.  LTD,http://vn1011750241.trustpass.alibaba.com/company_profile.html#top-nav-bar,http://vn1011750241.trustpass.alibaba.com/contactinfo.html, 84-08-54012589, 008497 6610761, 348 Ben Van Don Ward 1 Dist. 4,N/A, Vietnam, Ho Chi Minh City, HCM,
Java Robusta Green Coffee Beans Grade AP1,http://www.alibaba.com/product-detail/Java-Robusta-Green-strong-Coffee-strong_121721133.html,US $2000-2080 / Ton ( FOB Price),,,,,,,19 Metric Tons (Min. Order),,Not available,P.T. ALINDO MAKMUR SENTOSA INTERNASIONAL,http://alindo.trustpass.alibaba.com/company_profile.html#top-nav-bar,http://alindo.trustpass.alibaba.com/contactinfo.html, 62-31-8794126,N/A, Jl. Wonorejo Permai Utara 5 Blok Bb 328, 60296, Indonesia, Propinsi Jawa Timur, Surabaya,
Vietnam Robusta & Arabica Coffee Beans,http://www.alibaba.com/product-detail/Vietnam-Robusta-amp-Arabica-strong-Coffee_149362741.html,Not available,,,,,,,Not available,,Not available,VISIMEX JOINT STOCK COMPANY,http://johnnyvisimex.trustpass.alibaba.com/company_profile.html#top-nav-bar,http://johnnyvisimex.trustpass.alibaba.com/contactinfo.html, 84-8-38245800, 0084938867617, 6 th Flr Dakao Centre 35 Mac Dinh Chi street Dakao Ward District 1, 84, Vietnam, Ho Chi Minh City, Saigon,
arabica raw coffee beans,http://www.alibaba.com/product-gs/614917384/arabica_raw_strong_coffee_strong_strong.html,US $1000-2000 / Ton ( FOB Price),,,,,,,50 Kilometers (Min. Order),,Not available,Qingdao Rong Hai Xin Da International Trading Co.  Ltd.,http://rhxd.en.alibaba.com/company_profile.html#top-nav-bar,http://rhxd.en.alibaba.com/contactinfo.html, 86-532-86766658, 18660259987, 201A-03 Room Ruihua Building No.55 Mangu Road Free Trade Zone QingdaoChina, 266555, China (Mainland), Shandong, Qingdao,
Arabica Coffee beans,http://www.alibaba.com/product-detail/Arabica-strong-Coffee-strong-strong-beans_155435800.html,Not available,,,,,,,1 Twenty-Foot Container (Min. Order),,Not available,KA GLOBAL TRADE ZA(PTY) LTD,http://kaglobaltradeza.trustpass.alibaba.com/company_profile.html#top-nav-bar,http://kaglobaltradeza.trustpass.alibaba.com/contactinfo.html, 27-710-507229,N/A, 6 Belinda Street Del Judor Extension 4, 1035, South Africa,N/A, Witbank,
Vietnam High quality Arabica - Robusta Coffee Beans H47,http://www.alibaba.com/product-detail/Vietnam-High-quality-Arabica-Robusta-strong_155608686.html,US $7-8 / Kilogram ( FOB Price),,,,,,,1000 Kilograms (Min. Order),,Not available,DAI HOANG THUY CORPORATION,http://daihoangthuy.trustpass.alibaba.com/company_profile.html#top-nav-bar,http://daihoangthuy.trustpass.alibaba.com/contactinfo.html, 84-00-913942328, 84913942328, 95 Nhat Chi Mai,N/A, Vietnam, Ho Chi Minh City, Ho Chi Minh,
robusta coffee beans vietnam,http://www.alibaba.com/product-detail/robusta-strong-coffee-strong-strong-beans_135204715.html,Not available,,,,,,,20 Metric Tons (Min. Order),,Not available,ARTEX HANOI,http://vn1012871828.trustpass.alibaba.com/company_profile.html#top-nav-bar,http://vn1012871828.trustpass.alibaba.com/contactinfo.html, 84-4-37713351, 01234106830, 172 Ngoc Khanh, 84, Vietnam, Hanoi, Hanoi,
Vietnamese Green Coffee Beans,http://www.alibaba.com/product-detail/Vietnamese-Green-strong-Coffee-strong-strong_149441081.html,Not available,,,,,,,1 Twenty-Foot Container (Min. Order),,Not available,BAO TAM COMPANY LIMITED,http://vn100091890.trustpass.alibaba.com/company_profile.html#top-nav-bar,http://vn100091890.trustpass.alibaba.com/contactinfo.html, 84-4-9746365,N/A, 13b Ngo Batrieu Haibatrung Dist.  Hanoi Vietnam,N/A, Vietnam,N/A, Hanoi,
Arabica Roasted Coffee Beans,http://www.alibaba.com/product-detail/Arabica-Roasted-strong-Coffee-strong-strong_139573811.html,US $4500-7000 / Ton ( FOB Price),,,,,,,1 Ton (Min. Order),,Not available,LIFEMATE LTD,http://lifematecoffee.trustpass.alibaba.com/company_profile.html#top-nav-bar,http://lifematecoffee.trustpass.alibaba.com/contactinfo.html, 250-788357365, 788309432, Kacyiru, 250, Rwanda, Kigali, Kigali,
Arabica Green Coffee Beans,http://www.alibaba.com/product-detail/Arabica-Green-strong-Coffee-strong-strong_11206039.html,Not available,,,,,,,1 Ton (Min. Order),,Not available,THAI FOODS PRODUCT INTERNATIONAL CO. LTD,http://thaifoods.trustpass.alibaba.com/company_profile.html#top-nav-bar,http://thaifoods.trustpass.alibaba.com/contactinfo.html, 66-2543-7178, 66816563552, Ramkhamheang, 10310, Thailand, Bangkok, Wangthonglang,
Coffee Beans,http://www.alibaba.com/product-detail/-strong-Coffee-strong-strong-Beans_109577052.html,Not available,,,,,,,Not available,,Not available,BOLAY INTERNATION  TRADING,http://uk105415046.trustpass.alibaba.com/company_profile.html#top-nav-bar,http://uk105415046.trustpass.alibaba.com/contactinfo.html, 41-21-566 15 73, 0041795628159, Avenue de la Dole 2, 1005, Switzerland, Vaud, Lausanne,
coffee beans 100% Colombia,http://www.alibaba.com/product-detail/-strong-coffee-strong-strong-beans_148406094.html,Not available,,,,,,,1000 Kilograms (Min. Order),,Not available,EXPORTAME CONSULTING S.L.N.E,http://exportame.trustpass.alibaba.com/company_profile.html#top-nav-bar,http://exportame.trustpass.alibaba.com/contactinfo.html, 34-91-3526210, 0034620755175, Oliva, 28220, Spain, Madrid, Madrid,
Arabica Green Coffee Bean,http://www.alibaba.com/product-detail/Arabica-Green-strong-Coffee-strong-strong_142313958.html,Not available,,,,,,,19.2 Metric Tons (Min. Order),,Not available,RAJ EXIM,http://rajexim1.trustpass.alibaba.com/company_profile.html#top-nav-bar,http://rajexim1.trustpass.alibaba.com/contactinfo.html, 91-452-6453331, 9952538046, No 3 Balaji Street MGM Nagar Avaniyapuram, 625012, India, Tamil Nadu, Madurai,
Arabica green coffee beans,http://www.alibaba.com/product-gs/234666412/Arabica_green_strong_coffee_strong_strong.html,US $5.50-6.10 / Kilogram ( FOB Price),,,,,,,1 Kilogram (Min. Order),,Not available,Dehong Hogu Coffee Co.  Ltd.,http://hogoodcoffee.en.alibaba.com/company_profile.html#top-nav-bar,http://hogoodcoffee.en.alibaba.com/contactinfo.html, 86-871-65392451, 86-13888403275, 3/F HOGU BUSINESS CLUB INSIDE YUNNAN SCIENCE AND TECHNOLOGY ARCHIVES NO.1WEST CUIHU ROAD, 650031, China (Mainland), Yunnan, kunming city,
Cafe Direct Machu Picchu Gourmet Coffee Beans 227g,http://www.alibaba.com/product-detail/Cafe-Direct-Machu-Picchu-Gourmet-strong_147506576.html,Not available,,,,,,,Not available,,Not available,PREMIUM GLOBAL IMPORT LIMITED,http://uk1008130018.trustpass.alibaba.com/company_profile.html#top-nav-bar,http://uk1008130018.trustpass.alibaba.com/contactinfo.html, 44-7807081256,N/A, 53 Thorne Road, SW8 2BY, United Kingdom, London, London,
